DATA_KEY,SERIES_NAME,SERIES_NAME_SHORT,QUANTITY,ORIG_UNIT,INFO,COMMENTS,SO,TOPIC,SCORECARD_A,ORDER_A,SCORECARD_B,ORDER_B
EA.PRD.AGRI.KD,Agriculture value added per worker (constant 2000 US$),Agriculture,,Constant 2000 US$,"Agriculture value added per worker is a measure of agricultural productivity. Value added in agriculture measures the output of the agricultural sector (ISIC divisions 1-5) less the value of intermediate inputs. Agriculture comprises value added from forestry, hunting, and fishing as well as cultivation of crops and livestock production. Data are in constant 2000 U.S. dollars.",,SO2,Related to productivity/efficiency,TRUE,14,TRUE,5
AG.TFP.AG.GR1,Growth in total factor productivity in agriculture,Growth in total factor productivity in agriculture,,%,"A simple methodology to assess TFP is to adopt a Solow approach, which involves computing TFP growth as the difference between output growth and input growth, as follows: (TFP*/TFP) ?=(Y*/Y) ?-(X*/X) ?=dlogY/dt-?i(dlogX_i/dt). Instead, we estimate TFP by using a Cobb-Douglas specification Y=AK^? L^? where: Y is real output; A is a scalar; L is a measure of the flow of labor input; K is a measure of the flow of capital input. The parameters ? and ? will indicate if the production function operates in constant, decreasing or increasing returns to scale. By assuming a Cobb-Douglas production function, TFP can be derived as follows (McCloskey, 1972): TFP=A=Y/(K^? L^?). By transforming the above equation into log linear form, the parameters can be estimated by simple least squares. In particular, the above equation is linearized as follows: In Y = In A + ? In K + ? In L . Cobb-Douglas type production function equations are appropriate for the functional analysis intended for the agricultural activities (McCloskey, 1972; Fleisher and Yunhua, 1992). In addition, it is preferred since it provides easy calculation, ability to test production flexibilities statistically and to obtain sufficient number of degree of freedom even where data is very few etc. The model used in this study is given in Eq. 5, which is the revised form of conventional Cobb-Douglas production function in order to estimate TFP. In our dataset, output is Agricultural Gross Production Value (constant 2004-2006 million US$) (USD), inputs are divided in three sub-categories: (1) Total economically active population in Agriculture ; (2) Permanent meadows and pastures; Arable Land; Permanent Crops (3) Livestock: Cattle, Sheep, Pigs, Poultry. TFP has been estimated at Country-level.  All data source have been extracted from FAOSTAT databank. [References: Fleisher, B.M. and L. Yunhua, 1992. Economies of scale, plot size, human capital and productivity in Chinese Agriculture. Quart. Rev. Econ. Finance, 32: 112-123;  Goksel Armagan and Altug Ozden, 2007. Determinations of Total Factor Productivity with Cobb-Douglas Production Function in Agriculture: The Case of Aydin-Turkey . Journal of Applied Sciences, 7: 499-502;  McCloskey, D.N., 1972. The enclosure of open fields: Preface to a study of its impact on the efficiency of english agriculture in the eighteenth century. J. Econ. History, 32: 15-35.",,SO2,Related to productivity/efficiency,TRUE,15,TRUE,6
QC.YIELD.CRLS.HG.NO,Cereals yield (hg/ha),Cereals yield,,hg/ha,"Harvested production per unit of harvested area for cereals. Cereals include Wheat, Paddy Rice, Barley, Maize, Popcorn, Rye, Oats, Millet, Sorghum, Buckwheat, Quinoa, Fonio, Triticale, Canary seed, Mixed grain and Cereals, nes.",,SO2,Related to productivity/efficiency,TRUE,16,TRUE,7
QC.YIELD.RTTB.HG.NO,Root crop yield (hg/ha),Root crop yield,,hg/ha,"Harvested production per unit of harvested area for root and tuber crops. Roots and tubers are plants yielding starchy roots, tubers, rhizomes, corms and stems. They include Potatoes,  Sweet Potatoes,  Cassava,  Yautia (Cocoyam),  Taro (Cocoyam),  Yams,  Roots And Tubers Nes. .",,SO2,Related to productivity/efficiency,TRUE,17,,
QC.YIELD.OILCRPS.HG.NO,Oilcrop yield (hg/ha),Oilcrop yield,,hg/ha,"Harvested production per unit of harvested area for oil-bearing crops. Oil-Bearing Crops or Oil Crops include both annual (usually called oilseeds) and perennial plants whose seeds, fruits or mesocarp and nuts are valued mainly for the edible or industrial oils that are extracted from them. They include: Castor oil seed, Coconuts, Cottonseed, Groundnuts, with shell, Hempseed, Jojoba Seeds, Karite Nuts (Sheanuts), Linseed, Melonseed, Mustard seed, Oil palm fruit, Oilseeds, Nes, Olives, Palm kernels, Palm oil, Poppy seed, Rapeseed, Safflower seed, Seed cotton, Sesame seed, Soybeans, Sunflower seed and Tung Nuts.",,SO2,Related to productivity/efficiency,TRUE,18,,
QL.CW.PT.GR.NO,Poultry caracase weight (0.1Gr/An),Poultry caracase weight,,0.1Gr/An,"Derived from the production of meat from poultry birds, fresh, chilled or frozen, with bone in. All data shown relate to total meat production from both commercial and farm slaughter. Data are given in terms of dressed carcass weight, i.e. excluding offals and slaughter fats. Poultry meat includes Bird meat, nes, Chicken meat, Duck meat, Goose and guinea fowl meat and Turkey meat. .",,SO2,Related to productivity/efficiency,TRUE,19,,
QL.CW.BV.HG.NO,Bovine caracase weight (Hg/An),Bovine caracase weight,,Hg/An,"Derived from the production of meat from bovine animals including buffalos, fresh, chilled or frozen, with bone in. All data shown relate to total meat production from both commercial and farm slaughter. Data are given in terms of dressed carcass weight, i.e. excluding offals and slaughter fats.",,SO2,Related to productivity/efficiency,TRUE,20,,
QL.CW.OV.HG.NO,Ovine caracase weight (Hg/An),Ovine caracase weight,,Hg/An,"Derived from the production of meat from sheep and goats, including kids and lambs, fresh, chilled or frozen, with bone in. All data shown relate to total meat production from both commercial and farm slaughter. Data are given in terms of dressed carcass weight, i.e. excluding offals and slaughter fats.",,SO2,Related to productivity/efficiency,TRUE,21,,
QL.CW.PG.HG.NO,Pig caracase weight (Hg/An),Pig caracase weight,,Hg/An,"Derived from the production of meat from domestic or wild pigs (e.g. wild boars), fresh, chilled or frozen, with bone in. All data shown relate to total meat production from both commercial and farm slaughter. Data are given in terms of dressed carcass weight, i.e. excluding offals and slaughter fats.",,SO2,Related to productivity/efficiency,TRUE,22,,
QC.YIELD.FC.HG.NO,Fibre crop yield (hg/ha),Fibre yield,,hg/ha,"Harvested production per unit of harvested area for natural fibre crops. Natural fibre crops include Agave Fibres Nes, Cotton lint, Fibre Crops Nes, Flax fibre and tow, Hemp Tow Waste, Jute, Manila Fibre (Abaca), Other Bastfibres, Ramie, Seed cotton and Sisal.",,SO2,Related to productivity/efficiency,TRUE,23,,
EL.CONS.AG.NO,Conservation agriculture area share of agricultural area (%),Conservation agriculture,,%,Conservation agriculture area: >30% ground cover,,SO2,Related to practises and sustainability,TRUE,24,,
ER.LND.PTLD.ZS,Terrestrial protected areas (share of total land area),Terrestrial protected areas,,share of total land area,"Terrestrial protected areas are totally or partially protected areas of at least 1,000 hectares that are designated by national authorities as scientific reserves with limited public access, national parks, natural monuments, nature reserves or wildlife sanctuaries, protected landscapes, and areas managed mainly for sustainable use. Marine areas, unclassified areas, littoral (intertidal) areas, and sites protected under local or provincial law are excluded.",,SO2,Related to practises and sustainability,TRUE,25,,
ER.MRN.PTMR.ZS,Marine protected areas (share of territorial waters),Marine protected areas,,share of territorial waters,Marine protected areas are areas of intertidal or subtidal terrain--and overlying water and associated flora and fauna and historical and cultural features--that have been reserved by law or other effective means to protect part or all of the enclosed environment.,,SO2,Related to practises and sustainability,TRUE,26,,
ORG.TOT.AREA.HA.SH,"Organic agriculture, share of total area (percent)",,,%,"Organic agriculture area expressed as share of total area.  Data are from FiBL (Research Institute of Organic Agriculture) and International Federation of Organic Agriculture Movements (IFOAM) (2011). Data Tables from the FiBL-IFOAM Survey on Organic Agriculture Worldwide. The Organic World Website (www.organic-world.net) published by the Research Institute of Organic Agriculture (FiBL), Frick, Switzerland. Available at http://www.organic-world.net/statistics-data-tables.html.",,SO2,Related to practises and sustainability,TRUE,27,,
FO.FUNC.ENV.NO,Forest area primarily designated for provision of env and social services,Forest area primarily designated for provision of env and social services,thousand,ha,"The primary function or management objective assigned to a management unit either by legal prescription, documented decision of the landowner/manager, or evidence provided by documented studies of forest management practices and customary use. Protected areas - areas especially dedicated to the protection and maintenance of biological diversity, and of natural and associated cultural resources, and managed through legal or other effective means; Production - Forest area designated primarily for production of wood, fibre, bioenergy and/or non-wood forest products; Protection of soil and water - Forest area designated primarily for protection of soil and water; Conservation of biodiversity - Forest area designated primarily for conservation of biological diversity. Includes but is not limited to areas designated for biodiversity conservation within the protected areas; Social services - Forest area designated primarily for social services; Multiple use - Forest area designated primarily for more than one purpose and where none of these alone is considered as the predominant designated function; and Other - Forest areas designated primarily for a function other than production, protection, conservation, social services or multiple use. See Global Forest Resource Assessment.",,SO2,Related to practises and sustainability,TRUE,28,,
RP.PEST.TOT.TN.NO,Total pesticides use (tonnes),Total pesticides,,tonnes,"Pesticides refer to insecticides, fungicides, herbicides, disinfectants and any substance or mixture of substances intended for preventing, destroying or controlling any pest, including vectors of human or animal disease, unwanted species of plants or animals causing harm during or otherwise interfering with the production, processing, storage, transport or marketing of food, agricultural commodities, wood and wood products or animal feedstuffs, or substances which may be administered to animals for the control of insects, arachnids or other pests in or on their bodies. The term includes substances intended for use as a plant growth regulator, defoliant, desiccant or agent for thinning fruit or preventing the premature fall of fruit, and substances applied to crops either before or after harvest to protect the commodity from deterioration during storage and transport. Pesticides use data refers to quantities of pesticides applied to crops and seeds in the agriculture sector. Figures are expressed in metric tons of active ingredients. However, due to some country reporting practices, the data may be reported by: use in formulated product; sales; distribution or imports for use in the agricultural sector. In these cases it is specified in the country notes.",sum of all pesticides,SO2,Related to practises and sustainability,TRUE,29,,
RF.FERT.NB.TN.SH,Nutrient balances (test data),Nutrient balances (test data),,tonne/ha,"Balance of nutrients applied to the soil and nutrients removed by crops; risks associated with environmental problems, such as leaching (water pollution), ammonia emissions (air pollution), or emissions of nitrous oxide (greenhouse gas). A persistent deficit in indicates a risk for declining soil fertility.",,SO2,Related to practises and sustainability,TRUE,30,TRUE,9
RF.FERT.NI.TN.SH,Nitrogen fertilizer use per ha of arable and permanent cropland (tonne/ha),Nitrogen,,tonne/ha,"Total fertilizers consumption (N+P, N+P+K): Different fertilizers reported are summed to obtain total fertilizers consumption. Total Fertilizer Consumption is divided by Arable Land and Permanent Crops Area to obtain Consumption in nutrients/Arable Land and Permanent Crops Area. ",,SO2,Related to practises and sustainability,TRUE,31,,
RF.FERT.PH.TN.SH,Phosphate fertilizer use per ha of arable and permanent cropland (tonne/ha),Phosphate,,tonne/ha,"Total fertilizers consumption (N+P, N+P+K): Different fertilizers reported are summed to obtain total fertilizers consumption. Total Fertilizer Consumption is divided by Arable Land and Permanent Crops Area to obtain Consumption in nutrients/Arable Land and Permanent Crops Area. ",,SO2,Related to practises and sustainability,TRUE,32,,
RF.FERT.PO.TN.SH,Potash fertilizer use per ha of arable and permanent cropland (tonne/ha),Potash,,tonne/ha,"Total fertilizers consumption (N+P, N+P+K): Different fertilizers reported are summed to obtain total fertilizers consumption. Total Fertilizer Consumption is divided by Arable Land and Permanent Crops Area to obtain Consumption in nutrients/Arable Land and Permanent Crops Area. ",,SO2,Related to practises and sustainability,TRUE,33,,
RF.FERT.NIPH.TN.SH,Nitrogen and phosphate fertilizer use per ha of cropland (tonne/ha),Nitrogen and Phosphate,,tonne/ha,"Total fertilizers consumption (N+P, N+P+K): Different fertilizers reported are summed to obtain total fertilizers consumption. Total Fertilizer Consumption is divided by Arable Land and Permanent Crops Area to obtain Consumption in nutrients/Arable Land and Permanent Crops Area. ",,SO2,Related to practises and sustainability,TRUE,34,,
EN.EGY.US.AG.SH,Agriculture and forestry energy use as a % of total Energy use (%),Agriculture and forestry energy use as a % of total Energy use (%),,percent,Energy used in agriculture (ktoe-Kilotonne of Oil Equivalent):,,SO2,Related to practises and sustainability,TRUE,35,,
GHG.TOT.ALL.GG.NO,"All GHG agricultural sectors, total emissions in CO2eq (gigagrams)",All GHG agricultural sectors,,gigagrams,"Agriculture Total contains all the emissions produced in the different agricultural emissions sub-domains, providing a picture of the contribution to the total amount of GHG emissions from agriculture. GHG Emissions from agriculture consist of non-CO2 gases, namely methane (CH4) and nitrous oxide (N2O), produced by crop and livestock production and management activities.",,SO2,Related to practises and sustainability,TRUE,36,TRUE,10
GHG.NFC.NERCO2EQ.GG.NO,"Net forest conversion, total emissions in CO2eq (gigagrams)","Net forest conversion, total emissions in CO2eq (gigagrams)",,gigagrams,"GHG emissions data from forest land are currently limited to emissions from changes in total living biomass associated to net forest conversion to non-forest land. They consist of the net contribution of CO2 sources and sinks due to deforestation, reforestation and afforestation activities within countries. UNFCCC parties report these data in a more disaggregated fashion, under various land use categories. They are computed following IPCC, 2006, Vol. 4, ",,SO2,Related to practises and sustainability,TRUE,37,,
GHG.CO.NERCO2EQ.GG.NO,"Net cropland conversion, total emissions in CO2eq (gigagrams)","Net cropland conversion, total emissions in CO2eq (gigagrams)",,gigagrams,"GHG emissions data from cropland are currently limited to emissions from cultivated organic soils. They are those associated with carbon losses from drained organic soils. The FAOSTAT data are computed at Tier 1 following IPCC, 2006, Vol. 4, Ch. 5",,SO2,Related to practises and sustainability,TRUE,38,,
AQ.WAT.RFRWAGR.MC.SH,Share of freshwater resources withdrawn by agriculture (%),Share of freshwater resources withdrawn by agriculture,,%,"Water withdrawn for irrigation in a given year, expressed in percent of the total actual renewable water resources (TRWR_actual). This parameter is an indication of the pressure on the renewable water resources caused by irrigation.",,SO2,Related to practises and sustainability,TRUE,39,,
RL.AREA.FOR.HA.GR1,Forest area p.a. growth (%),Forest,,%,"Rate of net loss of forest area. Forest area is defined as land spanning more than 0.5 hectares with trees higher than 5 meters and a canopy cover of more than 10 percent, or trees able to reach these thresholds in situ. It does not include land that is predominantly under agricultural or urban land use.",,SO2,Related to practises and sustainability,TRUE,40,,
SI.POV.GINI,GINI index,GINI,,index,"Gini index measures the extent to which the distribution of income (or, in some cases, consumption expenditure) among individuals or households within an economy deviates from a perfectly equal distribution. A Lorenz curve plots the cumulative percentages of total income received against the cumulative number of recipients, starting with the poorest individual or household. The Gini index measures the area between the Lorenz curve and a hypothetical line of absolute equality, expressed as a percentage of the maximum area under the line. Thus a Gini index of 0 represents perfect equality, while an index of 100 implies perfect inequality.",,SO2,Related to practises and sustainability,TRUE,41,,
ER.BDV.TOTL.XQ,GEF benefits index for biodiversity (0 = no biodiversity potential to 100 = maximum),,,0 = no biodiversity potential to 100 = maximum,"GEF benefits index for biodiversity is a composite index of relative biodiversity potential for each country based on the species represented in each country, their threat status, and the diversity of habitat types in each country. The index has been normalized so that values run from 0 (no biodiversity potential) to 100 (maximum biodiversity potential).",,SO2,Related to practises and sustainability,TRUE,42,,
AQ.WAT.PROD.SH.NO,Agric. water productivity (const. 2005 US$ GDP per m3 of freshwater withdrawn by agric.),,,const. 2005 US$ GDP per m3 of freshwater withdrawn by agric.,"Water productivity is calculated as GDP in constant prices divided by annual total water withdrawal by agriculture, defined as annual quantity of water withdrawn for irrigation, livestock and aquaculture purposes. It includes renewable freshwater resources as well as over-abstraction of renewable groundwater or withdrawal of fossil groundwater, use of agricultural drainage water, (treated) wastewater and desalinated water. .",NV.AGR.TOTL.KD / AQ.WAT.WWAGR.MC.NO,SO2,Related to practises and sustainability,TRUE,43,,
EN.HPT.THRD.NO,Species threatened,,,,"Threatened species are the number of species classified by the IUCN as endangered, vulnerable, rare, indeterminate, out of danger, or insufficiently known.",,SO2,Related to practises and sustainability,TRUE,44,,
EE.BOD.FOOD.ZS,"Water pollution, food industry (share of total BOD emissions)",,,share of total BOD emissions,"Industry shares of emissions of organic water pollutants refer to emissions from manufacturing activities as defined by two-digit divisions of the International Standard Industrial Classification (ISIC), revision 2: food and beverages (31). Emissions of organic water pollutants are measured by biochemical oxygen demand, which refers to the amount of oxygen that bacteria in water will consume in breaking down waste. This is a standard water-treatment test for the presence of organic pollutants.",,SO2,Related to practises and sustainability,TRUE,45,,
EE.BOD.TXTL.ZS,"Water pollution, textile industry (share of total BOD emissions)",,,share of total BOD emissions,"Industry shares of emissions of organic water pollutants refer to emissions from manufacturing activities as defined by two-digit divisions of the International Standard Industrial Classification (ISIC), revision 2: textiles (32). Emissions of organic water pollutants are measured by biochemical oxygen demand, which refers to the amount of oxygen that bacteria in water will consume in breaking down waste. This is a standard water-treatment test for the presence of organic pollutants.",,SO2,Related to practises and sustainability,TRUE,46,,
EE.BOD.WOOD.ZS,"Water pollution, wood industry (share of total BOD emissions)",,,share of total BOD emissions,"Industry shares of emissions of organic water pollutants refer to emissions from manufacturing activities as defined by two-digit divisions of the International Standard Industrial Classification (ISIC), revision 2: wood (33). Emissions of organic water pollutants are measured by biochemical oxygen demand, which refers to the amount of oxygen that bacteria in water will consume in breaking down waste. This is a standard water-treatment test for the presence of organic pollutants.",,SO2,Related to practises and sustainability,TRUE,47,,
EL.CRBN.STK.WT,Average carbon content in the topsoil n weight (percent),Carbon,,%,"Soil quality can be defined as ﾓthe capacity of a specific kind of soil to function, within natural or managed ecosystem boundaries, to sustain plant and animal productivity, maintain or enhance water and air quality, and support human health and habitation"" (Karlen et al., 1997).  Soil quality is defined according to the soil functions (e.g. bearing function, production function, habitat function, resources function, reactor function) and cannot be measured by a single parameter. However, soil organic carbon has been defined by EUROSTAT as the more appropriate indicator for soil quality. High organic carbon content corresponds to good conditions from an agro-environmental point of view. Soils with organic carbon content less than 1% in weight are generally affected by soil degradation processes and erosion. On the other hand, soils with 1-10% organic carbon content have high agricultural value. ",,SO2,Related to practises and sustainability,,,,
EN.EPI.EP.NO,Environmental performance,Environmental performance,,%,"The Environmental Performance Index (EPI) is a comparative analytic tool for policymakers created jointly by Yale and Columbia Universities in collaboration with the World Economic Forum and Joint Research Centre of the European Commission. Data are drawn from 25 performance indicators that fall under well-established policy categories, including the environmental burden of disease, the effects of water on human health, and agriculture. The indicators serve as a gauge at a national government scale of how close countries are to established environmental policy goals.   See http://epi.yale.edu/",,SO2,Related to practises and sustainability,,,,
EN.EPI.EH.NO,Environmental health,Environmental Health,,%,"The Environmental Performance Index (EPI) is a comparative analytic tool for policymakers created jointly by Yale and Columbia Universities in collaboration with the World Economic Forum and Joint Research Centre of the European Commission. Data are drawn from 25 performance indicators that fall under well-established policy categories, including the environmental burden of disease, the effects of water on human health, and agriculture. The indicators serve as a gauge at a national government scale of how close countries are to established environmental policy goals.   See http://epi.yale.edu/",,SO2,Related to practises and sustainability,,,,
EN.EPI.ECO.NO,Ecosystem vitality,Ecosystem Vitality,,%,"A dimension of the Environmental Performance Index (EPI), which is a comparative analytic tool for policymakers created jointly by Yale and Columbia Universities in collaboration with the World Economic Forum and Joint Research Centre of the European Commission. Data are drawn from 25 performance indicators that fall under well-established policy categories, including the environmental burden of disease, the effects of water on human health, and agriculture. ""Ecosystem Vitality"" encompasses indicators on  Sulphur dioxide emissions per capita; Sulphur dioxide emissions per GDP; Change in water quantity; Biome protection; Marine protection; Critical habitat protection; Agricultural subsidies; Pesticide regulation; Growing stock change; Forest loss; Forest cover change; Fishing stocks overexploited; Coastal shelf fishing pressure; CO2 per capita; CO2 per GDP; CO2 emissions per electricity generation; and Renewable electricity. The indicators serve as a gauge at a national government scale of how close countries are to established environmental policy goals.   See http://epi.yale.edu/",,SO2,Related to practises and sustainability,,,TRUE,8
POP.TOT,"Population, total",Population,thousand,people,"Total population is based on the de facto definition of population, which counts all residents regardless of legal status or citizenship--except for refugees not permanently settled in the country of asylum, who are generally considered part of the population of their country of origin. The values shown are midyear estimates.",,SO2,,,,,
OA.AGR.POP.PPL.NO,"Agricultural population, total",Agricultural,thousand,people,"Agricultural population is defined as all persons depending for their livelihood on agriculture, hunting, fishing and forestry. It comprises all persons economically active in agriculture as well as their non-working dependents. It is not necessary that this referred population exclusively come from rural population.",,SO2,,,,,
POP.MALE,"Male population, total",Male,thousand,people,Male population.,,SO2,,,,,
POP.FEMALE,"Female population, total",Female,thousand,people,Female population.,,SO2,,,,,
QC.RHRV.FC.HA.NO,Fibre crop harvested area (ha),Fibre crop harvested area,,ha,See 'Fibre crops' and 'Crop area' in Concepts and Methods.,,SO2,,,,,
